{
  "schema_version": "1",
  "artifact_type": "plan",
  "plan_id": "FS0-GENESIS",
  "functional_set": "functional-set.json",
  "normative_changes": "normative-changes.json",
  "file_changes": "file-changes.json",
  "execution": "execution.json",
  "invariants": "invariants.json",
  "validation": "validation.json",
  "assurance": "assurance.json",
  "completion": "completion.json",
  "status": "candidate",
  "purpose": "Provide an implementation-complete Genesis contract without implementing the complete framework Design corpus.",
  "planning_boundary": {
    "predecessor": null,
    "build_must_not_invent": [
      "Design semantics",
      "framework authority topology",
      "normative requirements",
      "functional-set scope",
      "file mutation paths",
      "Conformance predicates",
      "Assurance obligations"
    ],
    "design_binding_source": "functional-set.json",
    "genesis_design_binding": "portable-content-addressed-snapshots",
    "repository_provenance_horizon": "initial-derived-fs0-genesis-commit",
    "historical_evidence_surface": "governed issue/pull-request lifecycle evidence after repository creation; the initial derived commit is the first repository-native provenance point"
  }
}
