{
  "schema_version": "1",
  "artifact_type": "plan",
  "plan_id": "FS1-EVIDENCE-FIXTURE",
  "functional_set": "functional-set.json",
  "normative_changes": "normative-changes.json",
  "file_changes": "file-changes.json",
  "execution": "execution.json",
  "invariants": "invariants.json",
  "validation": "validation.json",
  "assurance": "assurance.json",
  "completion": "completion.json",
  "status": "candidate",
  "purpose": "Exercise the ordinary post-Genesis Plan contract without Genesis-specific Design snapshots."
}
